<?xml version="1.0" encoding="UTF-8" ?>
<xs:schema xmlns:xs="http://www.w3.org/2001/XMLSchema" 
targetNamespace="http://www.piatpyt.org/2zadanie" 
xmlns:nasza="http://www.piatpyt.org/2zadanie" 
elementFormDefault="unqualified">

<xs:element name="addresses">
<xs:complexType>
<xs:sequence>
<xs:element name="plik">
<xs:complexType> 
<xs:sequence>
<xs:element name="informacje_o_pliku">
<xs:complexType>
<xs:sequence>
<xs:element name="opis_zawartości" type="xs:string"/>
<xs:element name="autor" type="xs:string"/>
<xs:element name="autor1" type="xs:string"/>
<xs:element name="data_modyfikacji" type="xs:date"/>
<xs:element name="osoba_modyfikująca" type="xs:string"/>

</xs:sequence>
</xs:complexType>
</xs:element>

<xs:element name="przychodnia">
<xs:complexType>
<xs:sequence>
<xs:element name="wizyty">
<xs:complexType>
<xs:sequence>
<xs:element name="wizyta" maxOccurs="unbounded">
<xs:complexType>
<xs:sequence>
<xs:element name="data_wizyty" type="nasza:typ_data"/>
<xs:element name="objawy" type="nasza:krotki_tekst"/>
<xs:element name="rozpoznanie" type="nasza:krotki_tekst"/>
<xs:element name="zalecenia" type="nasza:krotki_tekst"/>


<xs:element name="data_kolejnej_wizyty" >
<xs:simpleType>
<xs:union memberTypes="xs:string nasza:typ_data"/>
</xs:simpleType>
</xs:element>



</xs:sequence>
<xs:attribute name="numer" type="xs:ID" use="required"/>
<xs:attribute name="numer_id_pacjenta" type="xs:IDREF" use="required"/>
</xs:complexType>
</xs:element>
</xs:sequence>
</xs:complexType> 
</xs:element>


<xs:element name="baza_danych">
<xs:complexType>
<xs:sequence>
<xs:element name="karty_pacjentów">
<xs:complexType>
<xs:sequence>
<xs:element name="karta_pacjenta" maxOccurs="unbounded">
<xs:complexType>
<xs:sequence>


<xs:element name="numer_ubezpieczenia" type="xs:positiveInteger"/>

<xs:element name="dane_personalne">
<xs:complexType>
<xs:sequence>
<xs:element name="nazwisko" type="xs:string"/>
<xs:element name="imię" type="xs:string"/>
</xs:sequence>
<xs:attribute name="płeć" type="xs:string" use="required"/>
</xs:complexType>
</xs:element>

<xs:element name="wiek" type="xs:positiveInteger"/>
<xs:element name="numer_tel" type="nasza:typNr_tel"/>

<xs:element name="adres">
<xs:complexType>
<xs:sequence>
<xs:element name="kraj" type="xs:string"/>
<xs:element name="miasto" type="xs:string"/>
<xs:element name="kod_pocztowy" type="nasza:typKod_pocztowy"/>
<xs:element name="ulica" type="xs:string"/>
<xs:element name="nr_mieszkania" type="xs:positiveInteger"/>
</xs:sequence>
</xs:complexType>
</xs:element>
<xs:group ref="nasza:dodatkowe_informacje"/>



</xs:sequence>
<xs:attribute name="numer_id" type="xs:ID" use="required"/>
</xs:complexType>
</xs:element>
</xs:sequence>
</xs:complexType>
</xs:element>
</xs:sequence>
</xs:complexType>
</xs:element>
</xs:sequence>
</xs:complexType>
</xs:element>
</xs:sequence>
</xs:complexType>
<xs:key name="Idpacjenta">
<xs:selector xpath="./karty_pacjentów/karta_pacjenta"/>
<xs:field xpath="@numer_id"/>
</xs:key>
<xs:keyref name="Idrefpacjenta" refer="nasza:Idpacjenta">
<xs:selector xpath="./wizyty/wizyta"/>
<xs:field xpath="@numer_id_pacjenta"/>
</xs:keyref>
<xs:key name="Idwizyty">
<xs:selector xpath="./wizyty/wizyta"/>
<xs:field xpath="@numer"/>
</xs:key>
</xs:element>
</xs:sequence>
</xs:complexType>
</xs:element>



<xs:simpleType name="typNr_tel">
<xs:restriction base="xs:integer">
<xs:pattern value="\d{9}"/>
</xs:restriction>
</xs:simpleType>


<xs:simpleType name="typKod_pocztowy" >
<xs:restriction base="xs:string">
<xs:pattern value="\d{2}-\d{3}"/>
</xs:restriction>
</xs:simpleType>




<xs:simpleType name="typ_data">
<xs:restriction base="xs:date">
<xs:minInclusive value="1939-01-01"/>
<xs:maxInclusive value="2028-01-01"/>
</xs:restriction>
</xs:simpleType>

<xs:simpleType name="krotki_tekst">
<xs:restriction base="xs:string">
<xs:minLength value="1"/>
<xs:maxLength value="99"/>
</xs:restriction>
</xs:simpleType>

<xs:group name="dodatkowe_informacje">
<xs:sequence>
<xs:element name="alergie" type="xs:string"/>
<xs:element name="przebyte_choroby" type="xs:string"/>
<xs:element name="szczepienia" type="xs:string"/>
<xs:element name="grupa_krwi" type="xs:string"/>
<xs:element name="przyjmowane_obecnie_leki" type="xs:string"/>
</xs:sequence>
</xs:group>
</xs:schema>